id,score,store,text,userName,version,category,isGeneric,sentiment,subcategory,date,time
d7a43052-f75d-4b7c-8097-1726d98d2d2a,1,google,"O aplicativo é péssimo,faz mais de um mês que estou tentando finalizar minha conta e não consigo. Já mandei email com foto da mensagem, já falei com atendente e ninguém resolve nada.",Edna Medeiros,4.61.115,Complaint,0,Negative,Login,2024-07-18,02:13:57
9f2405a4-e8b0-49e4-a6fb-d11da7f8a9ef,5,google,Excelente App,Júlio Miasso,,Compliment,1,Positive,Generic compliment,2024-07-18,01:38:42
e8229eab-65cf-460a-a418-eee63b593535,5,google,Muito bom o serviço,Loyal Serviços,4.61.115,Compliment,1,Positive,Generic compliment,2024-07-18,00:04:27
7de3d1a1-844c-4b07-bbf1-dcf39edc0399,2,google,O aplicativo não abre. Possuo pontos do antigo Abastece-aí e agora não consigo acessa-los. Péssimo aplicativo!,Walas Oliveira,4.61.115,Complaint,0,Negative,Login,2024-07-17,22:51:20
90144888-a406-402f-99b4-e43e15b5244d,1,google,"Não está funcionando, fala que está carregando e atualizando meus dados e depois da erro, por favor arrumem o aplicativo.",Danilo Ortega,,Complaint,0,Negative,Performance,2024-07-17,22:48:45
a136a761-6fb8-4d76-988b-9d056bdec2a2,1,google,Não abre mais. Fica mostrando o logo,Marisa Abeid,4.61.115,Complaint,1,Negative,Login,2024-07-17,22:45:10
9ce03e97-84c1-49a6-9274-bd763e7266a3,5,google,Muito bom atendimento,Dario Piva,4.61.115,Compliment,1,Positive,Customer service,2024-07-17,21:56:30
37c547cb-e2a7-467c-a23d-994024febd05,3,google,"Só consigo pontuar e marcar até 300 reais ; abasteço meu automóvel e também meu caminhão sempre utilizando o app , porém não tem a possibilidade de inserir valores acima de R$ 300. Chega certo ponto que não consigo nem pontuar em cima dos R$300 nem ganhar meus km's.",Gustavo Trancoso,4.61.115,Complaint,0,Negative,Features,2024-07-17,21:18:36
f1d19fe1-c001-4088-b474-96554e254dc7,3,google,Muitas vezes não abre!,Robert,4.61.115,Complaint,1,Negative,Login,2024-07-17,19:53:28
9419136d-1b05-4961-b83b-22c1c1d90e2c,5,google,Muito bom e realmente prático o aplicativo e retorno real de cashbacks,Robinson Moraes de Oliveira,4.61.115,Compliment,0,Positive,Usability,2024-07-17,19:52:53
45f22c70-d90d-4fdd-a7c5-12cf166e3bbc,1,google,Não funciona. Deppis q mudou parou de funcionar. Será q fizeram isso pra fazer com q os usuários q tinham cashback perdessem??? Desrespeito com os usuários e clientes...,Carlos Alexandre,4.61.115,Complaint,0,Negative,Performance,2024-07-17,19:31:50
6274041c-d947-45e6-9682-26ce2b6bf950,5,google,Ótimo atendimento,Laura Del Basto,4.61.115,Compliment,1,Positive,Customer service,2024-07-17,19:31:00
1db88e29-9ead-42be-8ded-5f9d1b9a2967,3,google,Fui bem atendido,Regis Araujo,4.61.115,Compliment,1,Positive,Customer service,2024-07-17,19:12:19
47371e71-989e-4be8-a138-c71e9f59e953,5,google,Eles são top atendimento 10,Rafael Zamami,4.61.111,Compliment,1,Positive,Customer service,2024-07-17,17:49:08
b2ebcee2-8ce3-4e9c-bb73-8c2f108d2def,5,google,como sou motorista de aplicativo uso com Bastante frequência. porém o valor é baixo. perco pontos e cash back,sula demarche,4.61.115,Complaint,0,Mixed,Features,2024-07-17,16:28:35
75547a4b-f139-4d1f-a4ec-7473c0c61051,5,google,Massa dms,Jorge Lucas Mota,4.61.115,Compliment,1,Positive,Generic compliment,2024-07-17,15:56:08
602d339b-6a3a-4a21-8c09-b57da1e94b84,5,google,Ótimo aplicativo e atendimento,Luciana Barrow,,Compliment,1,Positive,Customer service,2024-07-17,15:53:57
ff98a576-07b4-4bd3-88a2-00e6d8008673,5,google,Eficiência e gentileza.,Lúcia Santos,4.61.115,Complaint,1,Positive,Generic complaint,2024-07-17,15:23:19
4c94444a-bfc4-4887-be6a-fc441db2eb0d,5,google,Muito boa,Gilvanez Campos,4.61.115,Compliment,1,Positive,Generic compliment,2024-07-17,14:33:44
d12d4701-6937-47fc-9c8e-0fb188921574,1,google,Desvincularam minha conta da Uber várias vezes. Me fazendo perder o cashback,Arthur Formiga,4.61.115,Complaint,0,Negative,Login,2024-07-17,13:59:39
cfc77e59-b0aa-4ec1-b576-1b9fe1b077ce,1,google,Nem sempre abre e tem que desistalar e instalar toda vez que isso acontece.,Waldir Moreira e Silva Moreira e Silva (Waldir),4.61.115,Complaint,0,Negative,Login,2024-07-17,13:44:16
e1f46f5d-dfc6-4529-8c1c-58cc230015f7,3,google,"Há um ano atrás avaliei com 4 estrelas e comentei que o extrato do saldo em conta precisava ser melhorado. Recebi feedback dizendo que seria melhorado, no entanto nada mudou. Também percebi que mudaram os critérios para receber Kms, está mais difícil. Portanto hoje avalio com 3 estrelas mas continuo utilizando e acreditando que vai melhorar.",Carlos Eduardo D'Amico,4.61.115,Complaint,0,Mixed,Performance,2024-07-17,12:35:49
b94e6dea-bc4e-4b03-a54b-597e430d62e5,1,google,SIMPLESMENTE NÃO abre o aplicativo e é muito instável. Não recomendo utilizar esse aplicativo. Medonho!,Gustavo Ramirez,4.61.115,Complaint,0,Negative,Login,2024-07-17,12:35:17
ad1e2c19-00a2-4f15-b141-3dfdc836493c,5,google,"Sou uber e não consigo as vezes ganhar meu desconto, qual o limite de abastecimento, pois abasteço todos as dias.",Rosi Lima,4.61.115,Complaint,0,Negative,Login,2024-07-17,12:33:22
f8f10562-ff3c-43fe-8dd4-9aaacee32937,3,google,"As vezes qdo vou abastecer, os fretistas não querem usar o aplicativo .",Vania Paulino,4.61.115,Complaint,0,Negative,Generic complaint,2024-07-17,12:04:46
0f110fd2-b520-4e64-b93c-bac23c179ab6,2,google,"Já tem algumas semanas que não o uso porque costuma travar e até perder o cadastro, ficando inviável sua utilização. Além disso, já não é mais tão vantajoso como era o Abastece, uma vez que para conseguir os 5% de cash back é preciso abastecer algumas vezes sem o benefício para acumular os pontos. Perde em praticidade frente ao Shell Box (com o qual é possível fazer o pagamento sem a necessidade de enfrentar a fila do caixa). Em resumo, já não vejo vantagem abastynos postos Ipiranga.",Nivio Ebele,4.61.115,Complaint,0,Negative,Login,2024-07-17,11:38:45
f29c7d91-7d49-4654-88c3-bc0c6c13b991,5,google,Muito boa,Rogerio Moreira dos Santos,4.61.115,Compliment,1,Positive,Generic compliment,2024-07-17,10:55:19
899a89fc-76c6-4906-9399-63a8fcb23f40,4,google,O aplicativo é bom. O programa de vantagens que não é dos melhores. É preciso acumular pontos de vários abastecimentos pra conseguir um pequeno desconto em um abastecimento. É fácil encontrar promoções melhores em aplicativos de outras bandeiras.,Anderson Neves,4.61.111,Complaint,0,Negative,Features,2024-07-17,10:43:37
2458f45b-1502-40ea-8553-d40ae14d3454,5,google,Maravilhoso,Marcia Maidanchen,4.61.115,Compliment,1,Positive,Generic compliment,2024-07-17,10:39:34
d1f58c55-e206-4cef-874e-bdf17804eda2,1,google,Tem um ano que tento acessar esse app e nunca consegui..mudei ate numero de telefone e nunca recebi um codigo..e agora fala desde ontem q foi atingido numero de requisicoes..na concorrente deu certo rapidinho!,Oseias,,Complaint,0,Negative,Login,2024-07-17,10:39:28
714dd81e-8596-4e64-b942-121467906ff6,1,google,Qual a utilidade do APP que está bugado? Irônico.,mateus dias carvalho (Matchos),4.61.115,Complaint,1,Negative,Performance,2024-07-17,10:25:00
f084f093-d201-491a-b241-c885ac32bcf3,5,google,Posto top atendimento nota dez,Mauricio Silva Massaut,4.61.115,Compliment,1,Positive,Customer service,2024-07-17,05:47:11
a097eb11-be74-468d-bff0-f91637d490a8,1,google,"O aplicativo não entra. Fica num looping infinito de uma animação, que deveria introduzir o aplicativo em si. Como outros aqui falaram, o app da concorrência é bem mais prático",Caio Vitor,4.61.115,Complaint,0,Mixed,Performance,2024-07-17,04:51:44
bc961006-b27e-4a3e-a37a-956bdcaa8449,5,google,O atendimento é de primeira qualidade...,Vitor Junger,4.61.115,Compliment,1,Positive,Customer service,2024-07-17,02:37:17
82fd4ee7-ca15-4a4a-80c2-62fc895b9971,3,google,"Tem sido recorrente a situação de nao conseguir pagar usanso o aplicativo , lá no posto lá casa os KMs porém não tenho os cashback. Não estou vendo vantagem alguma em privilegiar a Bandeira.",Subtenente Reina Instrutor de Tiro. FH1*,4.61.115,Complaint,0,Negative,Features,2024-07-17,02:07:56
e61cd7c8-428e-497c-969e-4c93f1365df5,4,google,"Melhorou muito mas, para quem usa o app na hora do abastecimento Dora muito a abertura.",Diego Dubin,,Complaint,0,Mixed,Performance,2024-07-17,01:24:37
839ae1a5-73e3-4c12-adbb-bd3e363c712f,5,google,"KMV(Abastece-aí) sem nenhuma dúvida é o melhor aplicativo para abastecer, resolver, comprar e guardar! Bem como o melhor cash que recebemos. O melhor aplicativo que dá liberdade de escolhas para seus usuários.",Hedwi Fernandes de Castro e Silva,4.61.115,Compliment,0,Positive,Generic compliment,2024-07-17,01:08:43
52ff1520-315e-4619-aafb-234cf188d6f9,5,google,Maravilhoso funciona mesmo ... E é uma grande ajuda,Julia Flores,4.61.115,Complaint,1,Positive,Performance,2024-07-17,00:48:47
a4eabfaf-0a35-42a1-b87c-d8543757bcb7,2,google,"Aplicativo as vezes demorado para entrar. Ocacionamente pede senha, se esquecer já era.",Moacir Veiga,4.61.115,Complaint,0,Negative,Login,2024-07-17,00:40:29
b8c4a597-fe0f-4b94-8e1a-e79c746bb40a,3,google,Deveria ser bem melhor!,João de Assunção Andrade Nunes,4.61.115,Compliment,1,Positive,Generic compliment,2024-07-17,00:35:01
a22e7a10-47d7-4757-96a5-006fe79176b7,5,google,Muito boa a experiência com o aplicativo.,Leandro Siqueira Fraga,4.61.115,Compliment,1,Positive,Generic compliment,2024-07-17,00:33:31
e2ca7e7e-7042-4c13-b898-9825f0f2cc7e,5,google,"Melhorou muito o app. Ficou mais fácil e mais atrativo! Só abasteço com o app e é mais prático! Só acho que deveriam fazer de um jeito que não precisasse ir até o caixa do posto e aprovasse o pagamento direto, seria mais cômodo!",Romulo Kulka,4.12.000104,Complaint,0,Mixed,Performance,2024-07-17,00:28:00
c0b3f2d5-6f0e-4bfb-902e-39be53ecdae2,5,google,"O problema foi resolvido, e já estou usando o app, a um bom tempo nas redes de postos Ipiranga.",Alex Paiva,4.61.115,Complaint,0,Negative,Servicess,2024-07-17,00:25:14
569a93d2-4f32-407b-a63d-1a6fb07f2542,5,google,O aplicativo está cada vez melhor. Simples de operar e cashback instantâneo para cada abastecimento.,Antonio Sebba,4.61.115,Complaint,0,Positive,Generic complaint,2024-07-17,00:15:11
e99252ee-8b6c-452e-b589-eb8c2f42104a,3,google,Já foi pior. Hj tá razoável.,Leo C,4.61.115,Complaint,1,Negative,Generic complaint,2024-07-17,00:04:17
bb3db871-b014-4ace-9dbd-b9e4555e13ce,2,google,"descontos muito pequenos, parcerias fracas, sorteios que não acontecem, tudo muito ruim!",Fernando Camacho,4.61.115,Complaint,1,Negative,Generic complaint,2024-07-16,23:33:20
caaccaef-4b70-4b0d-86d6-aba837fdccc0,5,google,"App muito importante, Recomendo.",Josenilson Souza,,Compliment,1,Positive,Generic compliment,2024-07-16,23:30:07
5bff2cea-3b7a-4f6c-bda2-de59521b7321,5,google,Muito bom,Elias Silva azevedo,4.61.115,Compliment,1,Positive,Generic compliment,2024-07-16,23:19:12
62166e32-8f87-4cf8-937a-0f32b20f9912,1,google,Antes era melhor agora piorou,Leandro Estefanoi,4.61.115,Compliment,1,Positive,Generic compliment,2024-07-16,23:18:37
2acb18e9-0321-4131-9bed-3a344cb0e96b,5,google,"Bom atendimento nos postos, aplicativo com bom funcionamento e ótimas ofertas",Cleovir Theis,4.61.115,Compliment,1,Positive,Customer service,2024-07-16,23:12:37
e3d9f178-93d5-42a9-b422-037361f1a610,5,google,Aplicativo muito. Temos muitas vantagens.,Roberto Cabral,4.61.115,Compliment,1,Positive,Generic compliment,2024-07-16,23:12:26
5a5c60cb-746c-465d-b2f4-6f9255a94c47,1,google,O app fica me desligando da minha conta uber e depois não consigo por um tempo logar,Jefferson Cassiano,4.61.115,Complaint,0,Negative,Login,2024-07-16,23:02:29
1f2a6d5c-8d93-4401-8a39-5926df637915,4,google,App melhorou bastante mas algumas vezes que vou abastecer aparece a mensagem que já excedi o limite de abastecimento diários sendo que nem abasteci ainda naquele dia 🤔🤔🤔,Carlos Henrique Gomes dos Reis,4.61.111,Complaint,0,Mixed,Login,2024-07-16,22:54:02
b945a7e9-9cf2-475f-902c-9967d3cd5620,5,google,"Bom aplicativo,muito intuitivo,fácil de utlizar e o bom que tem retorno de abastecimento em percentagem.",Jerre rodrigues,4.61.115,Compliment,0,Positive,Usability,2024-07-16,22:50:21
98e7045b-381c-4ea3-8a74-3b056a1759d4,5,google,Muito bom,Claudio Hirata,4.61.115,Compliment,1,Positive,Generic compliment,2024-07-16,22:36:01
b8711944-bb8a-44c2-bc68-7564593e8ab7,5,google,É maravilhoso esse aplicativo,Iêda Almeida,4.61.115,Compliment,1,Positive,Generic compliment,2024-07-16,22:27:57
84ce53fb-c019-489c-9b57-62b08fa3438a,1,google,Infelizmente o aplicativo apresenta falhas após a última atualização.,Christian Santos,4.61.111,Complaint,0,Negative,Performance,2024-07-16,22:24:40
023664f6-2f8c-45e5-9516-f6050c3f641c,4,google,gostaria de dar 5 estrelas mas só vou dar 1 pois tenho 6.344 km estou usando somente para abastecer minha van escolar abasteco uma a duas vezes por semana e já faz duas semanas que não consigo utilizar os km pois diz na msg que atingi os km mensais já enviei email com print da msg que aparece e sem retorno,Andreia Del Rio,4.61.115,Complaint,0,Negative,Login,2024-07-16,22:23:48
67605bcc-0973-4d65-a04f-6c3771657a3f,1,google,"Preço nunca sai o mais barato que mostra nos anúncios, propagandas enganosas",Diego Lima,4.61.115,Complaint,0,Negative,Generic complaint,2024-07-16,22:23:06
954f5b28-9275-4266-add7-67a723ad7022,4,google,Bom só o site que as vezes não funciona!,Quelci Alves Moreira,4.61.115,Complaint,1,Negative,Performance,2024-07-16,22:22:27
65fcffa4-72a8-4bbc-996f-7738a3f9977a,5,google,App sensacional,Jefferson Pereira,,Compliment,1,Positive,Generic compliment,2024-07-16,22:22:16
eb3d4005-c63b-41d7-a3df-c66d1ef4e12b,1,google,Baixa mais não dá pra termina o cadastro,Luciano Freitas,4.61.115,Complaint,1,Negative,Login,2024-07-16,22:20:19
4b5aa480-8310-4240-9d31-f1eb3499d391,5,google,Show parabéns 👏🎊 felicidades,Mariana Feri,4.61.115,Compliment,1,Positive,Generic compliment,2024-07-16,22:19:45
f82d5d42-cdfa-4495-aa9e-acb12c90f5a1,5,google,Bom atendimento. Combustível de qualidade.,Robervaldo Souza Filho,4.61.115,Compliment,1,Positive,Customer service,2024-07-16,22:13:18
b48fa993-3ba5-46a9-8242-99489a87c64e,5,google,Utilizo a muitos anos e recomendo.,Dam Carlos,4.61.115,Compliment,1,Positive,Generic compliment,2024-07-16,22:09:03
0ff44a8c-76a0-483b-8058-b4b6da69c28a,5,google,"Muito bom, não tenho nenhum problema com o aplicativo",Roberto Reis,4.61.115,Compliment,1,Positive,Generic compliment,2024-07-16,22:07:23
f37c9af2-81f7-407c-b373-1f12bee4c5c8,2,google,"Depois dessa atualização, não estamos mais podendo fazer o acúmulo avulso, eu usava muito isso, quase todos os dias eu passo em frente a um posto, só que os frentistas dizem que não tem mais como acumular sem abastecer. Não gostei. Inclusive, não está tendo mais as promô de quinta feira. Mudou pra muito pior.",Ronaldo Paresqui,4.61.115,Complaint,0,Negative,Performance,2024-07-16,22:06:01
650fc2a5-90b5-4481-9c0e-3ba7efb5e00d,5,google,Muito bom tô adorando,Gil freitas BERNARDINO,4.61.115,Compliment,1,Positive,Generic compliment,2024-07-16,22:02:40
34255da3-494e-468f-89a4-cfc3d0d8d265,1,google,Sempre sem sinal,Daniel Laino,4.61.115,Complaint,1,Negative,Servicess,2024-07-16,22:01:58
cc36211d-d37c-4d47-8f33-719ad077b752,1,google,O APP dar muitos erros,Moises Pinheiro,4.61.115,Complaint,1,Negative,Performance,2024-07-16,22:01:43
0a5a00b0-6c03-4069-984d-c688a13582c5,5,google,Bom app. Todo desconto é bem vindo,Marcelo Teixera,4.61.115,Compliment,1,Positive,Generic compliment,2024-07-16,22:01:27
60360d57-f439-4c19-8fd6-609a6f0e2502,5,google,App super top,jefferson campos,,Compliment,1,Positive,Generic compliment,2024-07-16,21:59:53
660c98ca-683d-4429-8189-e6d6a314dfcb,5,google,Excelente o aplicativo parabéns,Luiz Dos Santos,4.61.115,Compliment,1,Positive,Generic compliment,2024-07-16,21:56:21
c6699420-119b-48f6-9758-bdff882f6537,1,google,Quando peço pra colocar meu CPF frentista diz que sou Vip que não consigo gravar meus kmv,Marco Branco,4.61.115,Complaint,0,Negative,Login,2024-07-16,21:55:24
e6c25e91-cb8e-4d51-a083-b1fc66ae2628,2,google,"O app já foi melhor, muito desconto de ponto e pouco ganho de pontuação ao abastecer.",Wesley Batista,4.61.115,Complaint,0,Negative,Generic complaint,2024-07-16,21:55:03
c78005d1-69dd-4638-b582-d19c93ce0473,5,google,O app ficou muito bom. Está eficiente. Uso pra abastecer.,João Paulo,4.61.115,Compliment,1,Positive,Generic compliment,2024-07-16,21:54:21
46458938-8d5d-4b33-87f0-66ff09f2e0a6,5,google,Parabéns faz corretamente o que oferece,Rodines Bortolli,,Compliment,0,Positive,Customer service,2024-07-16,21:54:07
73ffaaf5-07c8-4835-bf3e-fb3af2d1d8a7,1,google,"E horrível,nunca dá pra usar,sempre aquela frase (você atingiu o limite diário),e não está mais valendo a pena,mesmo com o suposto desconto ainda sai mais caro que no concorrente com o valor normal!!",Rudson Silva,4.61.115,Complaint,0,Negative,Performance,2024-07-16,21:53:15
81720a3c-00ad-4149-889f-15b7b25379a3,5,google,Show de bola,Sidney Veras,,Compliment,1,Positive,Generic compliment,2024-07-16,21:50:18
a730e22f-6def-469f-b0c5-54d931726a43,4,google,Duas vezes seguidas não consigo pontuar,Reginaldo Souza de Rezende,,Complaint,1,Negative,Login,2024-07-16,21:47:31
75b4966c-e80d-4be7-a0bd-bbef235eea1e,5,google,"O cash back é eficiente e honesto. Além do desconto, já aconteceu várias vezes de eu abastecer e ter descontos maiores",Cid Penteado,4.61.115,Complaint,0,Positive,Login,2024-07-16,21:46:11
5d29ea07-a89f-45b5-8f48-19ee3d8f37ba,5,google,O aplicativo em si é bom mais possuem bugs na hora de pagar pelos cartões cadastrados tem ficar adicionado via Pix .,alfredo carlos,4.61.115,Complaint,0,Mixed,Features,2024-07-16,21:45:00
550ba93b-0561-4b79-b7cc-d92d8503cc07,5,google,APP rápido e que ajuda bastante no pagamento do abastecimento,Giovanni Rodrigues,4.61.115,Compliment,0,Positive,Usability,2024-07-16,21:43:08
b6c92669-4c2a-41ae-8598-df1c436e9ef1,5,google,Ótimo atendimento é preço médio,Tiago K Scholz,4.61.115,Compliment,1,Positive,Customer service,2024-07-16,21:42:57
11e48407-b341-4c7e-9c6a-938cf07ef84c,5,google,Funciona muito bem cashback é sempre bem-vindo além de ter praticamente uma conta criada pelo Ipiranga seria bom se tivesse um cartão para uso de débito super recomendo,ACR Serviços e Segurança,4.54.124,Compliment,0,Mixed,Customer service,2024-07-16,21:42:55
a50acaf5-26cc-4d73-857c-7e2612ea7bc6,1,google,"A tempos estou no aguardo de uma devolutiva/ resolução referente ao valor de $ 182,00 extraviado da minha conta que somplesmente sumiu e sem nenhuma justificativa ou esclarecimento dos deptos responsáveis. Essa é a gestão pífia e omissa de uma empresa com tamanha envergadura como a Ipiranga, ausência clara de processo, sem liderança participativa e sem nenhuma preocupação ou zelo com a imagem da marca. Para piorar, o mkt não se posiciona, cadê a diretoria concomitante presidência dessa cia.",Ricardo Meneguetti,4.61.115,Complaint,0,Negative,Servicess,2024-07-16,21:39:53
cc5b9ad7-d2a1-4e7e-afdc-54200c2b86ba,3,google,Duas vezes que tentei pontuar o app não funcionou.,Cleo MELO,4.61.115,Complaint,1,Negative,Generic complaint,2024-07-16,21:38:54
0da5a8f6-3454-41a9-b312-48b5e6f67eb5,2,google,"Vc abastecer 100,00, e ter um Cash back de 1,00, é brincadeira né.",Patricia Alencar,4.61.115,Complaint,1,Negative,Servicess,2024-07-16,21:38:44
a2cbf033-ba7e-4655-99b1-731d15274dd5,5,google,Boa,Flavio Mirandamartins,4.61.115,Compliment,1,Positive,Generic compliment,2024-07-16,21:38:34
5b63029a-6267-44a7-9369-0cb21e7dd21e,4,google,melhorou o app era péssimo,leandro,4.61.115,Complaint,1,Negative,Generic complaint,2024-07-16,21:37:35
a9cfee4f-2591-4968-8c5b-bcbae6b7ef42,5,google,Ótimo,Andriel Oliveira,4.61.115,Compliment,1,Positive,Generic compliment,2024-07-16,21:37:23
34fc611a-505b-4444-ab2d-d58a84c7c81e,5,google,Bom de uso,marcelo benedito,,Compliment,1,Positive,Generic compliment,2024-07-16,21:36:39
af8287eb-79fc-4804-99db-81ad9919f867,2,google,"Até agora nunca ganhei nada, e só abasteço com o app, difícil de entender, mas de 3 anos amos usando...",francilin freitas,4.61.115,Complaint,0,Mixed,Performance,2024-07-16,21:35:39
9260a8a8-6e36-43ae-81a4-abe2eb9fb3d4,3,google,"A cada 2 vezes que vou abastecer, uma o aplicativo não funciona. Ou fica carregando e não abre ou o frentista digita o código e não funciona. Ainda insisto pois tenho cashback pra receber, mas estou próximo de largar mão",Alan Reis,4.61.115,Complaint,0,Negative,Performance,2024-07-16,21:35:33
34737bc0-da5d-4cbb-a67e-db3e85cc7636,3,google,"O App é bom, bem completo, porém pra mim apresenta uma falha ao selecionar o Posto favorito, ele não fica salvo como favorito, consequentemente não acumula os pontos x 2.",Christian Silva,4.61.115,Complaint,0,Mixed,Performance,2024-07-16,21:34:49
8f00fc41-6bdf-4ea8-b5ad-ac99ffef856f,5,google,"App intuitivo para qualquer procedimento, sem contar com os km de vantagens que utilizo sempre na movida. excelente app, só abasteço por ele. Recomendo",Ygor Baicere,4.61.115,Complaint,0,Positive,Features,2024-07-16,21:34:37
69793f5a-2117-43db-9914-4e46a3eb2c2e,5,google,Ótimo aplicativo.,Odirlei Pereira,4.61.115,Compliment,1,Positive,Generic compliment,2024-07-16,21:34:22
02f477a0-5e85-41cc-8111-34bfa59e281d,5,google,O sistema de cashback é muito bom,Wendell Cardoso Marinho,4.61.115,Compliment,1,Positive,Generic compliment,2024-07-16,21:33:23
8db627e6-241e-4064-9755-e074af9801dd,5,google,Melhor que o Premmia e o programa da Shell,Israel Assunção,4.61.115,Compliment,1,Positive,Generic compliment,2024-07-16,21:32:46
4979ed74-ad68-4fcb-9695-837f545a8f7f,5,google,Tudo certo até o momento.,Lucas Cardoso,4.61.115,Compliment,1,Positive,Generic compliment,2024-07-16,21:32:45
ea0298d9-c5b3-4de2-bcc6-8ca0fbb03450,1,google,"Não estou gostando, pois quando vc abastece um valor mais alto o App não aceita, só diz que vc já atingiu o valor limite, então só serve para motoqueiro e que rode pouco! Misericórdia um negócio desse.",Marcelo Chiosini Baio,4.61.115,Complaint,0,Negative,Features,2024-07-16,21:32:12
14266739-a827-447e-9c1b-55f060a5a733,1,google,Fiz pagamento pelo APP descontou e não consegui abastecer e não fui estornado,Bruno,,Complaint,0,Negative,Features,2024-07-16,21:31:44
704465c9-6073-453a-ad32-a47254dc5fdc,5,google,agora melhorou não fica mais saindo a parceira com a uber obrigando a add a uber todo ves que ia usar,sergio neiva,4.61.115,Complaint,0,Negative,Generic complaint,2024-07-16,21:31:35
b0ac57ec-a61d-41a1-b89f-c77c6256cb0f,5,google,Aplicativo é ótimo,GEAN CARLOS,4.61.115,Compliment,1,Positive,Generic compliment,2024-07-16,21:31:25
8710091f-bb09-4b47-9320-1becf905eee7,4,google,Bom aplicativo.,Leonardo Cardoso,4.61.115,Compliment,1,Positive,Generic compliment,2024-07-16,21:31:08
840a0c87-7d5d-4051-9a90-b066800802cc,5,google,Ótimo,Leandro Pavlak,4.61.115,Compliment,1,Positive,Generic compliment,2024-07-16,21:31:04
99404799-66a8-4ea8-9b38-16ee8f75197d,1,google,Péssimo! Nunca funciona quando abasteço,Marcos Moreira,4.61.115,Complaint,1,Negative,Performance,2024-07-16,21:31:01
28f4b047-e80e-4260-90d6-d261db5d79a6,2,google,Já perdi descontos com ele e agora o valor some quando vou pagar pelo aplicativo,Marcelo Rocha,4.61.115,Complaint,0,Negative,Features,2024-07-16,21:30:34
26d00287-d8f9-4604-afc4-10b5f444a5a8,5,google,"Ótimo app. Sendo categoria diamante, vc recebe 10% de desconto na gasolina. Ainda mais nos dias de hoje, porque o litro de gasolina custa 6,75.",João,4.61.115,Complaint,0,Positive,Customer service,2024-07-16,21:30:10
c6e022c5-45f8-4d1c-9dbe-78c6dd11708e,5,google,muito satisfeito,FRANCISCO LIRA,4.61.115,Compliment,1,Positive,Generic compliment,2024-07-16,21:30:08
90912b5a-98b1-4e90-90fa-78f279a7fbe1,5,google,"Sim é isso mesmo, particularmente eu tenho utilizado, e tem funcionado, como é sugerido o serviço.",Jandilson,4.61.115,Complaint,0,Neutral,Servicess,2024-07-16,21:30:05
897dac43-7abc-4732-8d46-bc15e2131ec6,5,google,Atendimento de primeira,Milton Ribeiro de Lara,4.61.115,Complaint,1,Negative,Customer service,2024-07-16,21:30:02
69830403-d0eb-487e-b474-da426e1a32e6,1,google,O aplicativo nao me manda o poppap de notificao de qdo chega o pix so nesse aplicativo de banco acontece isso,Alexandre Fernando Neres Lopes,,Complaint,0,Negative,Servicess,2024-07-16,21:29:55
5c401553-158f-49cd-9405-c9a07732b3c2,5,google,"Frenéticas sempre muito atenciosos, instruindo utilizar o app....",VINICIUS CARDOZO,4.61.115,Compliment,1,Positive,Customer service,2024-07-16,21:29:42
4b5c9afa-6507-4333-8ec3-21e48271eecf,5,google,App nota 10,Paulo Padovam,4.61.115,Compliment,1,Positive,Generic compliment,2024-07-16,21:29:40
7bcc036f-1f3d-4480-a285-755f0627a2fd,1,google,"Ganhei um cupom de 25$ porem nao consigo usar pois diz que esta bloqueado , mesmo atendendo todoa oa requisitos de uso.",Diego Nathan,4.61.115,Complaint,0,Negative,Login,2024-07-16,21:29:31
d2467477-77db-42fe-afff-bf9ad4f4493d,1,google,Horrível,Almyr Sousa,4.61.115,Complaint,1,Negative,Generic complaint,2024-07-16,21:28:50
fa196e0c-a5bf-48a0-aac2-31a8ba36ce3a,4,google,"É bom mas bem instável, ano passado sumiram 20 mil kms meus e nunca mais recuperei , mesmo falando com suporte.",Adriano Cousseau,4.61.111,Complaint,0,Mixed,Performance,2024-07-16,21:28:39
3d776e14-f4af-4bb0-a97c-2b740eadea9f,5,google,Esse KMV é bom demais!!!,Regina Carriel,4.61.115,Compliment,1,Positive,Generic compliment,2024-07-16,21:28:31
c151926c-eec9-4cf5-96ff-ee9e2276fd16,5,google,O app é bastante intuitivo porém encontro dificuldades para acumular pontos porque abasteço todos os dias mas nem todos podem acumular,Wagner Ramos,4.61.115,Complaint,0,Mixed,Servicess,2024-07-16,21:27:23
